story,maslow
"Raju is a brilliant student. he is not only good at his studies, but also he is an excellent football player. playing football for his country is his ultimate aim. Raju's father is a poor man and his earnings are not enough to meet his family needs. he understands his son's wishes and motivates him to achieve his aim in life. he is a good motivator and works hard to earn money. Due to his father's motivation, raju is selected for the football world cup and played for his nation and wins the world cup. his father arranges a grand reception to receive his son who is the main reason for winning world cup. everyone is happy. hard work never fails.",1
The woman sees the shadow and is afraid and runs away. The woman is cuddled by an animal and she is terrified. She has a fever. So she rests in bed.,2
"Pietro wanted to police officer when he growing up He started working hard towards becoming a police officer , he built up his body and knowledge And peitro finally become a deputy officer on his 23rd birthday",2
"Ralph was getting ready to leave the office to go home. As he was driving, he saw they mayor participating the town parade. Because ralph didn't pay attention to traffic, he ended up getting into a car accident with another car.",0
Susan was at the railway station to pick up her daughter Susan and her daughter were chatting while driving back home Susan crashed her car at an intersection as she was not paying attention to the road.,0
Peter had been working hard on a presentation all month and he was nervous about how it would come across. The day of the presentation he had forgotten a vital piece of information so the presentation was not accurate. The next day when peter came in to work his boss informed him that he was fired.,0
Steve was lonely because he didn't have a significant other and spent all his time working. Steve decided to ask a woman that he knew out on a date. Steve and the woman got married and made a child together which they loved.,1
The great dictator was going to start a war He decided to have a parade instead Then an old man gave him a bird and he became very happy and called off the war.,1
"Bobby was a football player and had a tournament that week. Due to his rash driving, he met with an accident. He got admitted in the hospital and no longer play the match.",0
Ben was nervous but took a chance singing at a karaoke bar. Mary thought that ben was singing badly on purpose and laughed. Ben left the karaoke bar in tears and called one of his friends.,1
The train brought Billy to the beach for the first time. The train broke down and Billy thought he couldn't go to sea. The train started again and Billy was happy to see the sea for the first time!,2
"Joanna, a travel writer, had become bedridden after falling ill and her doctors couldn't figure out what was wrong. They conducted numerous tests and discovered that joanna had contracted a rare but curable illness while overseas. After a short course of treatment, joanna was back to normal and feeling great, able to laugh again now that her health had returned.",0
John is an athlete and is very fond of playing football. He travelled abroad along with other team players to play in summer olympics. He returned to his home town as the winner with a gold medal and received a grand welcome from the people.,1
Mary fretted over what to buy her rich friend for her birthday. She finally decided on a simply wrapped jewelry box. Her rich friend took one look at the gift and burst out laughing hurting mary's feelings.,1
My husband threw a surprise party for my 50th birthday and took me on a treasure hunt that led to an amazing surprise present. When i opened the last clue and was led to the final clue it was a poem about us going on a trip to scotland. The trip was the trip of a lifetime because i stood on the north end of scotland thinking about the clan and how important my heritage is to me.,1
The boy was suffering from fever After two days the boy was cured. and he is playing a football The boy went to the shopping. he bought everything what he likes,2
Woke up to find his favorite plant dead. Learned his company was laying everyone off. Won the lottery the next day.,0
"Sidney is a young man who is terribly stressed over an important presentation he has to give at his new, high-paying job. He tries his best on the presentation, but he makes many mistakes and his boss fires him. Sydney turns to food to console himself after his failure, and ends up obese, miserable, and alone.",2
A man named jon was very tired of the daily grind of his construction job. Jon decided to book a flight out to the wild west for a vacation. Jon spent his vacation in the great outdoors and found himself newly refreshed and inspired by life.,2
"Lisa was a beautiful girl, but somehow couldn't find a man who wanted to settle down and raise a family. One day, lisa was walking and met bill. Lisa and bill fell in love and began a family right away.",1
"Mr. brown was nearing retirement age and looking forward to spending his golden years in comfort. To boost his retirement income, mr. brown invested his savings in a fund that promised to return a high percentage. However, the fund turned out to be a scam and mr. brown lost his savings and his home, leaving him homeless and broke.",0
"Josh was in a car accident and was hospitalized and given pain medication. He became addicted to the pain killers and lost all motivation in life. He lost his job, relationship and home and ended up on the street begging for money and food.",0
Alex was feeling alone and isolated doing nothing but playing video games at home. He decided to go for a walk in the nearby park. On his walk he met a girl and fell in love.,1
"Tommy is an angry boy who fights with other boys and gets into trouble all the time. However, he discovers soccer in 6th grade and channels his energy and aggression into organized team activity. When he graduates from high school, tommy joins the military and uses the discipline he gained through sports to become a successful and highly decorated soldier.",2
Joan is pregnant with her first child. She went into labor and went to the hospital. She gave birth to a healthy girl.,0
Jack has severe head pain Jack went to the doctor Jack health improves and he starts jogging,0
"Kate met alex at a mutual friend's birthday party. They enjoyed each others company so much they ended up getting together every single day of the summer. Alex's father got transferred to japan and the whole family had to move, so alex and kate had to say goodbye, perhaps forever.",1
"Tommy was excited to visit his grandparents in another state with his father. Out of nowhere, another car crossed the center line and ran into tommy's car. Instead of visiting his family, tommy spent the holiday in the hospital.",0
"Alex is a young and dynamic person, who was working at a company. One day, he made a plan to go hiking in the desert alone. It was a bad decision as he fell ill after coming back from the hike.",0
A woman and her son were on a road trip to a country they had not been to. They came into a large dark tunnel and proceeded through it. When they came out of the tunnel they were greeted by a military man who arrested them.,0
The playing football in a ground The boy suddenly wanted to go to the beach and playing in a sand He drive a car it was accident,0
"He scored the winning goal with his amazing kick. He thought of his grandfather, who had always supported him in that moment. He was so proud of himself that he achieved his goal of winning the season.",1
Matthew was a famous singer and went abroad. His wife got sick and was in bed. He could not return home immediately and was crying for this incident.,1
"Rick got tired of watching tv all day and decided he'd play outside. Rick decided he was going to go to the park to play some soccer. He tripped while playing and broke a bone, making rick have to be hospitalized.",0
"Simon was a lonely child and didn't have any friends. To make himself feel good, simon turned to food and ate lots of sweets. Simon grew up and became a sad, overweight adult who only found comfort in food.",1
"Scientist Gregory went hiking one day. When Gregory reached the top of the mountain, he saw a huge lightning bolt. Gregory was inspired by his lightning to write innovative scientific papers in his field.",2
Sara was a 90 years old-lady. Sara did not have enough to eat. Because of hunger she died at last.,0
Gary plays soccer with his friends in wet weather. Gary enjoys a wide variety of junk food after playing. Gary falls ill and ends up in the hospital.,0
Jay got very drunk. Jay decided to go for a ride in his car and had a bad accident. Jay died after his car crash.,0
A man is working in military He travelled across the country without his family His daughter was worried about leaving his father.,1
Andrew was a hero and everyone wanted to get close to him. Andrew started to believe that all women wanted to be with him. Andrew's constant sexual harassment eventually caused his downfall and arrest.,2
I loved playing games at a very young age. As a teenager i practiced playing my favorite video game for hours each day. Now i am a professional gamer and making lots of money.,2
The boy is scared to ask the girl out on a date. The boy decides to be brave and ask her out by texting her. The girl happily accepted and is making herself pretty for the date.,1
"He has a beautiful garden in his house. However, he did not visit the garden because he remembered his dead wife. Finally, he visited the place to reminisce his memories with her wife and enjoyed the place.",1
Jane was so concerned about her pimples and pimples on her face that she went to the hospital for treatment. She was cured with medicine and medicine and looked beautiful and happy,2
"Patrick decides to change his job to become a stock trader. Patrick was warned of an upcoming market downturn, but he ignored the warning. He eventually loses all his money in the stock market and is now homeless.",2
"John was a funny baby, and loved to make his mom laugh. When he was 18, he decided to try stand-up comedy. John became an instant hit, and the biggest celebrity in his town.",2
Mia decided to become instantly rich with the amount she had. Mia decides to achieve it through gambling. But mia's decision ended up wrong. he lost all the money he had and became a debtor.,0
Ryan played an amateur piano on the street to raise money one day. Ryan played the piano so well that he appeared on the news and on TV. Ryan's performances in the news made him famous and made a lot of money as a pianist.,2
"Sofy went shopping and bought some groceries. After arriving home, she ate some of the food without knowing it was stale. After a while, she started vomiting and was taken to the hospital",0
"Billy was sick in the hospital and dreaming of going to the beach. As soon as he got out of the hospital, he got on a plane and flew to the beach. The beach was beautiful and he enjoyed his time there.",2
"Tom is the everyday average person who leaves his office job to go to a routine doctor's appointment. The doctor examines Tom and gives him some extra tests. Tom learns that he has a serious, incurable disease.",0
"Jimmy liked to eat a lot of sweets, like donuts and cupcakes. Jimmy ate so much candy that he put on weight a lot. At his next appointment, the doctor told Jimmy that he had high blood sugar and could get very sick.",0
John likes to play soccer John was injured while playing and was hospitalized. John is recovering from all his injuries,0
He was happy when he realized he was full after the first donut. He was glad he could catch the pot before it could boil over. They all agreed that fruit was the best option for dessert.,0
Victoria noticed she was much more hungry than usual with odd cravings. She goes to the doctor who tells her she is pregnant. Her deeply religious family shuns her because she is pregnant out of wedlock and nobody shows up to her baby shower.,1
"Doctor watson is a fertility specialist at the city's hospital. Kimberly swanson was just informed by doctor watson that after suffering through 8 years of infertility, she is pregnant. Kimberly relaxes after her baby shower knowing she will be a first time mom very soon.",1
The doctor told larry he needed to lose weight or would face serious health issues. Larry ignored the advice and continued to overindulge with snacks. Larry was laid to rest after a fatal heart attack.,0
Two person got into some disagreement and the boy went away from his girl friend. To resolve the conflict the girl was given the product to his boy friend. Then they re united happily and hugged each other.,1
"Mark was once a very healthy person and an avid runner. One day he became seriously ill and had to be hospitalized. Unfortunately, his doctor told him that he was terminally ill with an incurable disease.",0
There was a women who was going to become a mother of a girl. The father was always playing music for the baby girl. The girl loved her father's music so much she became the best dancer in town.,1
Jessica is a famous model and singer She met with a fire accident at an event and had burns on all over her body . She became ugly and scared on seeing her face in a mirror.,0
"Gary and terry played a fast paced and competitive soccer game. The game got so heated that the boys got into a skirmish on the field. Later that night gary and barry, who was a teammate of gary, called terry and they all apologized to each other and vowed to remain good friends.",1
Emily sat at home eating junk food all day. The doctor asked her to stop her bad habits and take up dancing. Emily followed his advice and is now a successful ballerina.,2
Charles wanted to me a motivational speaker but he was overweight and insecure Charles decided one day to motivate himself and exercise and lose weight to be healthy Charles felt confident again and became the motivational speaker he dreamed of being,0
Maria thought she wanted to get dressed up. She went into her bedroom and put on make-up. The girls in town made fun of Maria because they thought her make-up was ugly.,2
Stella went to gamble because she was in dire need of money. Luckily it was her night and she won a lot of money. She can't control her luck and laughed like hell at the money she won.,0
"Tom made a New Year's promise to all the fun adventures he'd been putting off for years. The next day, Tom hiked the Grand Canyon and he was living the life he wanted. Unfortunately his boss called him back to work and Tom had to return to his office the very next day.",2
Joseph and his son are travelling by car. He calls his friend and talks to him while driving. His distracting behavior while driving caused him a fatal crash.,0
Timmy got caught out in the rain while walking home from school and got very wet. The doctor came to look at timmy and said he had a very bad cold and a high fever. Timmy had to stay in bed for a week and could not see any of his friends because he was sick.,0
Bill fell asleep on his couch and was late to work. Bill got into a car accident as he rushed to work. Bill is arrested for causing the car crash,0
Bob was poor and didn't know where he could get money to pay his rent. Bob decided to rob a bank and get a lot of money. The police showed up shortly after and arrested bob for his crime.,0
"Billy was excited to travel as lock down was lifted But he was meet with an accident while driving his car Billy broken his leg and was admitted at the hospital, doctor said he has to take rest for at least 3 months",0
She drives to see her friend. She is meeting a new friend and sharing the happy . She is eating a cake because our favorite cake.,1
John was an athlete and used to practice every day. One day he has an accident and is hospitalized. A few days later he recovered and started playing football.,2
John was an athelete and he used to pratise everyday One day he met with an accident and was hospitalised After some days he recovered and started playing football,2
Jonathan has been sick for a week now and is in the hospital. The doctor comes to jonathans with possible good news about a new medication to treat his condition. The new medicine helps jonathan feel much better and he is now able to go hiking again.,0
The child was sick in the hospital The doctor came to visit The doctor said the child's parents had just been called to pick him up and that he would be fine,0
Cena is a famous football player One day cena life was changed because of his car accident Unfortunately he lost his right leg and he could not able play ever.,0
Mary was getting ready for her blind date. She met tom at the entrance gate to a beautiful park. Mary and tom had an amazing time at their picnic in the park and shared a hug after agreeing to go on a second date.,1
"Mary had not been feeling well and was worried about her baby in the final triamester of her pregnancy. She went to the doctor, and he came in with the news, the baby would need to come now. The baby was delivered and arrived into the world happy and healthy after giving his mother a fright.",1
"Caroline return to home from school with thinking about to buy a new makeup box . At evening caroline used her mother's lipstick and get ready for shopping to buy the makeup box. On the way for shopping she noticed a begger sitting near the shop, caroline felt pity about him,and gave the money to him which she kept to buy makeup box,after donating she felt very happy.",2
"Tom's father was an active marine. A war broke out in a foreign country, so he was deployed. Unfortunately, tom's father was killed in the war, and he misses him very much.",1
"The man, tom, had lost everything and was living on the street. Tom was left a fortune and decided to take music lessons. He went on to become a world renowned pianist.",2
The day was bright and sunny. Amy decided to run to the park to meet her friend jake Amy saw jake trip over a branch and break his leg.,1
Bill was out of shape and very unhealthy Bill started exercising daily and lost weight. The doctor told him he healthy and no longer overweight.,2
The lady riding the road She never saw a boy playing a keyboard in the street. They had an accident and both were admitted to the hospital.,0
"Hercules is owned by a nice old woman and lives in a very nice home. One day, the old woman got into a car accident. The old woman died and hercules had to go to a shelter.",0
Mary was running to school. She missed the beginning of the lesson. She went outside and started to cry.,2
There was once a boy that was very sick at a young age. He was taken to a world famous doctor to find out why he was sick. The doctor found out what was ailing the boy and cured him and now the boy is happy and healthy.,0
"Kirby was homeless, broke, and hungry. He took the risk and stole some groceries from a local grocery store. When he was leaving the store, a police officer stopped and arrested him.",0
"Kevin was heartbroken when he learned he had died of overwatering his favorite plant. So he studied plants intensively. Despite his best efforts, he did not water and the plant died.",2
Carl lived in a house haunted by ghosts that disturbed him while he was reading. One day Carl found a book about exorcism. Now the ghosts are gone and Carl can read books in peace.,2
John and his son smith was going to a park to celebrate smith's birthday However earlier that day john was doing some fitting in his car John failed to check his break which lead to a failure so they met with an accident,0
"Miguel worked with her father, who grew produce. He found a new place to sell the things they grew. Now they have more money than before.",2
The couple were in love and they decided to get marry The girl is pregnant She delivered a cute lovely baby,1
"Francisco was tired of just painting all the places he wanted to visit. One day francisco got a large inheritance from his uncle. Now, francisco can travel the world and visit all the places he painted.",2
John is a very hardworking person and worked day and night sincerly. As a result of his hardwork he earned lot of money. He invested all the money in a business and become the boss.,1
Daria rushed home after school to play a new video game. She still had to do her homework before she could play video games. She did her homework in record time and was finally able to play.,2
Ben and roy got in a fight at school and were mad at each other. They both went home and played video games to cool off. The next day at school they were in better moods and made up from their fight and became friends again.,1
Stella's went for gambling as her friends told her to go. She was loosing money in gambling because she knows very less about it. After she lost all her money in gambling she yell at her friends with anger.,1
Ronaldo is a stage singer and he loves nancie from past two years. He went nancie home and proposed her but she said no and then ronaldo went sadly. Next day nancie called ronaldo and accepted his proposal. ronaldo was so happy.,1
"Bob was always fat, stressed, ate junk food, and often ate two or more donuts. Bob often works long hours in a stressful job and travels frequently, but has little time for free time. After all, Bob went on a long vacation to a Caribbean island that he had always wanted to visit.",2
"Tom and mary met in kindergarten. 20 years later, mary got pregnant with tom's baby Tom later got sick and died before his baby was born",1
Mary planned to visit a new country for her yearly vacation. Suddenly there was lightning and storm that disrupted flights. She was sad that she had to spend her vacation inside the house.,0
Tommy had been sick with a rare blood disorder. The doctor suggested an experimental new drug. The drug was a success and within weeks tommy was healthy enough to play soccer.,0
"Debra was a glutton and eats too much Debra's friends warned about her body structure. so, she runs daily to reduce her body weight. Debra became a great dancer and a singer.",2
Sue and her son johnny are driving to go see their family in town. Sue gets distracted and crashes into the car in front of them. Johnny gets badly injured in the crash and has to spent weeks in the hospital.,0
"Sidney is a very stressed young man with an important presentation to his new high-paying job. He does his best in his presentation, but he makes a lot of mistakes and his boss fires him. After a failure, Sydney turns to food to comfort herself, eventually becoming fat, miserable and alone.",2
"His hobby is football. However, he knew that football could not be his profession, so he looked for other talents. And I found that he sings very well. He participated in the audition and was evaluated by the judges for his gift-like voice.",2
John lost his money at his business. One day he plays solitaire game and win huge price money. And john turn into happy life.,0
Stella went for gambling because she needs money badly. Luckily that was her night and she won lot of money She cannot control her happiness and laughed to hell about the money she won.,0
Levi baker was a singer. he was very popular in the music world. One day after completed the concert he was fighting with his colleague due to some personal reasons. He was eliminated from the next show due to fight so he was very felt sad and crying.,1
"A women got very pregnant. Soon enough, she had a baby boy to look after. They would go to the beach and enjoy their day.",1
John was very sad because he suffered heavy losses in his business. But he started new business of film making. Now he is very successful and even brought a private jet for himself.,1
"After Danny noticed that she had gained a lot of weight, she decided to diet and exercise more. Danny exercised regularly for several weeks and ate a healthy diet. Unfortunately, after a month, Danny returned to the bad habit of eating junk food and not exercising.",2
Andrew was popular and everyone wanted to be close to him. Andrew began to believe that everyone wanted to be with him. Andrew's constant lies eventually led to his downfall.,2
Sara was a 90 year old lady. Sara didn't have enough to eat. She finally died of hunger.,0
He always studies well in his college He got a good job and works well The boss of the company praises his work,2
Steven is very poor man but very hard working. He is preparing for interviews and doing part time job for survival. After so much struggle in his life he was happily placed in an corporate company.,2
Karthi was in a car accident. It put him in bed with horrific injuries. But he woke up with his determination and surprised everyone.,2
The man came home and told his father that he's going out on a date with a girl he just met. The date went very well and the girl found the man very amusing and laugh constantly at his jokes. The women later became the man's wife and became pregnant with their first child.,1
"The politician was cheered by the crowd. When the gunfire rang, people ran. Politicians are given life only to harvest his organs.",2
"Sam studied well, worked hard, and lived a good life. He started playing video games and fell in love with it. He was so addicted that he lost everything and became homeless.",2
"Jackson's mom called him to come right home. When he got home, his mom told jackson that someone came and stole all the money she had saved. Without money, jackson and his mother were forced to live on the streets.",0
"John and peter were siblings, without knowing their parents they took the car and went for a ride. Unfortunately they met an accident with another car. Younger brother peter got injured and hospitalized after the accident.",0
Debra was a glutton and ate so much that Debra's friends warned her about her physique. So she runs every day to lose her weight. Debra became a great dancer and singer.,2
