story,maslow
"Anne, a little girl, ran away from home because she was upset with her parents. Anne kept running down a dark train tunnel and got scared. But thanks to a news broadcast looking for her, anne's parents found her and anne was glad to come home.",1
Mia has finished her last exams and it's finally summer break. Mia hugged her best friend ben on her last day of school before her summer break. Mia is so happy she doesn't have to go to school during her summer break.,1
Michael wanted to get healthy and lose weight. His girlfriend broke up with him because he spent too much time exercising. Michael ended up being depressed and eating food and gaining a lot of weight.,1
He is playing to the foot ball he is very happy to the moment. She is meeting to the boyfriend so he is very happy to the moment. They drive together and wrap up their date.,1
"Doctor named safety , wanted and spoked about wearing mask all the time when you go out to to safeguard against covid 19 infection , warns about the illness caused by the virus A person name dontcare , went to super market with out wearing mask and doesnt follow the safety guidelines issued by the doctor and the health department , he is well dressed and wears cool glasses for himself but the very must mask is not weared Mr dontcare , tested positive against covid 19 and getting treatment in hospital and the doctors said he is very critical and his lungs is fully infected by virus and doctors are tried hard to save his life .so people dont go out without wearing mask in this pandemic situation",0
The teacher's class on graphs for the exam was confusing. Joe studied for the exam all night long. Joe found out the next day and passed the exam.,2
Jack is shopping for food to finally try and cook dinner for his family. Jack told his wife and son of his dinner plan and they were very supportive of his ambition of cooking such a large meal. Jack pulled a miracle and managed to cook a fantastic dinner with very little experience.,2
Ben was unexpectedly deployed to assist in a peace keeping mission. After 7 months in iraq he didn't know how he was going to make it through an entire year. On ben's birthday he was called to his sergeant's office. ben wondered what he had done wrong and worried about the punishment. as he opened the door his wife jumped out and surprised him. his commander had arranged for a visit to cheer ben up.,1
Euvi loved manik very much Euvi gave a gift to manik on his birthday Manik understands euvi's love to him and accepted euvi as his lover,1
"Robert, william and james were friends. William and james locked robert inside a restroom. Robert came out and fought with james.",1
Rose invited her best friend tony to her birthday party and tony promised her . But tony was ill that day and could not attend the party Rose was very sad without tony in her birthday party.,1
A boy was thinking about what he wanted to do with his life. He ended up wanting to play soccer and became very good at it. He became so good he made a lot of money doing it.,2
"Sidney is a very stressed young man with an important presentation about his new high paying job. He does his best in his presentation, but he makes a lot of mistakes and his boss fires him. After failure, Sydney turns to food for comfort and eventually becomes fat, miserable, and alone.",2
Francisco is tired of painting every place he wants to visit. One day Francisco received a great inheritance from his uncle. Now francisco can travel the world and visit every place he painted.,2
Emily sat at home eating junk food all day. Her doctor told her to stop her bad habit and do her dance. Emily followed his advice and she is now a successful ballerina.,2
Sheela was getting ready to meet her friend after long gap She met her boyfriend in a park and hugged her She was so happy after that meeting,1
The boy was playing football in a ground He doing his job very well but he eat sweet too much. He was very feel for his fat,0
"John felt blue, because he wanted to be a comedian, yet needed confidence. He went to an open mic night at a local comedy club, and had a great set on stage. The audience gave john a standing ovation, and he performs comedy now.",1
"When Alice was a young girl, she suffered from anxiety and lacked confidence. Growing up, people who knew Alice, like her sister Mary, laughed at her all the time. Alice grew up without believing in herself and became homeless as an adult because she had no career or friends.",2
The lady thought she could eat as many donuts as she wanted. Now she feels sick and after a year she has put on a lot of weight.,0
"He is singing a song, so he is happy She is gifted in friend, so she is happy feeling. She offered him an audition, and he won and became a star.",1
Mary ran to school. She missed the start of her class. She went outside and started crying.,2
Mohit is a hard worker. he is a father of rithesh. mohit loves his son very much. Mohit's ultimate goal is to make his son a doctor. he worked day and night and saves lot of money for his son't study. Rithesh understands his father's pain for his success. he studied well and join in medical school and he completed his doctor degree and become a doctor. his father mohit arranges a grand reception to receive his son as a doctor. both of them really proud about each other.,1
The homeless man lost his job and had to beg for money. He saved all the money people gave him. He was able to buy a house will all the saved up money.,0
Hank and him mom are driving in the car. Someone hit their car and both hank and his mom were injured. Hank is in the hospital with serious injuries.,0
Mathew has met with an accident in school Peter always had fight with his friends in playground He was exhausted due to the work stress,0
Raheem's teacher takes lessons for him. he does not focus on his studies. He always thinks about playing soccer while sitting in the classroom. he never listens to the class teacher and keeps dreaming of football. He looks very nervous on the day of the exam. he doesn't know the answer to any questions. his dream of football did not help him with the exam. he is not passed in the exam.,2
Melissa goes to the bathroom at the airport to refresh herself. She says that Melissa spends more than 30 minutes refreshing her clothes there. Her announcement that her plane was taking off when she came out surprised her with me.,2
Sara and john loves each other. One day john fight with his friend. Sara watching that fight she sad immediately.,1
Thomas invites a classmate out for a date. They spent the afternoon in the park but he is nervous that it isn't going well. His date hugs him and tells him that she had a great time.,1
Chris was playing video games too much because he didn't know what else to do. He decided to go outside and find something else to do. He discovered the game of football and discovered that he is a great player and loves sports!,2
Alexhad a childhood bestfriend named alice. As they grew older alice moved to a different school and they lost touch. Alex became depressed and overweight as he always longed that one day alice would return.,1
The pregnant lady is visiting the hospital The lady is asked to get admitted The baby is born,0
"George and his son hated the city they lived in because of the constant rain. They finally decided to move to a new place. They loved the new city with the clear, clear sky.",2
The kid was sick in the hospital The doctor came to visit The doctor said that the kid's parents were just called to pick him up and that he is going to be okay,0
Nancy was in a horrible mood. Her friend paul told her a funny joke. Nancy laughed so hard she forgot her troubles.,1
Sam and his son Michael flew to Colorado for a vacation. They drove to the state park to enjoy the scenery. They climbed to the top of the ridge and jumped over the beautiful scenery.,2
"Noah attends a singing competition and he is very tension about his competition. He is very well singing in competition. Finally, he wins the award.",2
"Phillip, who loves to sing, dreams of becoming a great singer. He worked hard, practiced every day and started singing. Philip became very famous as his celebrity grew and he poured the love and affection of people everywhere he went.",2
Jack feel proud after winning the lethal combat. He is so happy that he dances with joy in the combat field. He was shot because he was so visible that his friends are in tears and in a lot of pain.,1
The boy had a high fever so he is admitted in a hospital The old women struggle in her life to cure her grandson .no one help to her Eventually he got psychosis due to high fever.,0
"Mary's family was seated at the dining table ready to eat their meal. Mary told them the food was still cooking and not ready, so they would have to wait. They were impatient so Mary went to taste it on the stove and her mouth burned badly.",0
Bon watched tv instead of studying for his college exams. He had to spend all night at the library to catch up. He was so tired that he got into an accident on the way to take his exam.,2
"Lisa and roy have fallen in love Lisa got pregnant after marriage with roy Lisa felt alone after the marriage with roy, as he doesn't care about her",1
Frank's car gets hit on his way to work. The accident makes frank late to work. He gets fired and has to beg for money.,0
"Harry did not go to work and he simply sits and eating in his young age. He spends money without worries. In his middle age, he cries due to not saving money in his young age.",2
San felt very hungry after having continous online classes. He thought of going to the nearby pizza store but it was a heavy rain. But for san's surprise his mom has preapared him a yummy treat.,0
Anna's dream is to become a dancer as she is very fond of dancing. She gives an awesome performance in a competition. She is happy that her performance is appreciated by one and all.,2
Jackson was office to leaving in home to happy meet to father Jackson fast to driving in car.so was jackson car is accident to opposite car Finally jackson was admit in hospital for treatment.,0
"Ram was an explorer and was looking for treasure. After more than a month of exploring the desert, Ram finally became rich in search of treasure.",2
"The cat, lisa, is lonely because she has no friends She went out of the house for the first time for finding friend She met a new friend and is no longer lonely",1
"The land was barren and barren. People worked together to install irrigation and plant crops and trees. After several generations, the land was restored to its natural balance.",2
"Kevin was heartbroken when he found out that he had died from over-watering his favorite plant. So he studied hard about plants. Despite his efforts, he did not water and the plant died.",2
Bon watched TV instead of studying for college exams. He had to stay up in the library all night to catch up. He was so tired that he had an accident on the way to the exam.,2
Frank had lots of work to do in the field Franked worked hard in the hot weather without any water Working all day dehydrated frank and he got sick and needed iv fluids,0
When adam was a child he always seemed to be attracted to violence and loved to start fights with his classmates. When he got older adam joined the military because he wanted to fight and use his weapon to shoot people. Adam was so reckless during a dangerous mission that he was killed and his body was sent home and buried.,1
"Jim should do his homework after school. Instead, he played video games for hours and never finished his homework. When his mother found out, she got angry and yelled at him.",2
Eric is feeling sweaty and tired. Eric books an appointment online to visit a local doctor. The doctor confirms he has covid-19 and he is concerned.,0
Tom was playing football on the road nearby his house Tom ran behind the ball as he kicked where a car was coming fast on the road. Unfortunately the car dashed him to accident and tom got admitted in the hospital for treatment.,0
Andrew who is an artist is nervous to meet anna to confess his love for her. Anna gets ready to look beautiful as she is going to meet andrew whom she likes a lot. Both express their love for each other and decides to be soul mates for ever.,1
"Joffrey spent time training to become a better athlete. He took part in the real game. He did his best, but he still cried because he wasn't good.",2
The boy had a high fever and is being hospitalized. The old women struggle to heal their grandsons in their lives. Nobody helps her. Eventually he developed psychosis due to a high fever.,0
"Baby charles loved to play with his toys He also liked to explore his parents large home But, he really loved when his father would play happy songs on the piano",1
"Alex was very good at driving cars. he won a race at the local car championship. One day he was riding the car on highway but he was riding way over the speed limit. one car was coming from the front and he could not control his car, so it resulted in an accident. Alex suffered major injuries and was hospitalized. moral-never driver over the speed limit.",0
Jane used to enjoy dancing to music. As she got older she could no longer dance. Then jane discovered that she loved playing music for others to dance to even more.,2
"At school eliza was bullied constantly. Eliza ended up binge eating to cope with the pain. One day she decided to stand up to her bullies and tell them ""no more!"" she felt better about herself after that and her life started to improve.",1
"Stephanie was feeling sick so she went to see her doctor. The doctor told her she was just run down and needed to rest. After resting up, stephanie felt so much better and was able to enjoy a laugh with her friends the next day.",0
"Sam was studious, worked hard and had a good life. He started to play video games and was hooked to it. His addiction got so bad that he lost everything and ended up homeless.",2
"A bully started punching sam in school, hurting him really badly. Sam was taken to the hospital and placed on a drip Sam was released from hospital and reunited with his best friend",0
John and amy were very close friends. amy likes to talk with john John was not able to concentrate in his studies so he decided to ignore amy. Amy felt sad after knowing that john is ignoring her.,1
Joanne and jaime were teenagers with high ambitions of making a lot of money in a short period. They managed to get a business going selling mdma to their fellow high school students. They were caught by a teacher and were expelled from school.,2
John was sad after breaking up with his girlfriend. He started to write piano music to forget about his heart break. John ended up really enjoying piano and it became his passion to play whenever possible.,1
"She is mary, she has more disappointments, so she feel lonely She is angry with friends for breaking her promise, so she shouting She is very happy that she knows it was all a surprise party, so she is dancing",1
Jack and jill were upset with each other over a small fight they had. Jack decided he'd try to explain his point of view fully and help jill understand they can be friends. Jill knew he was being sincere and they forgave one another.,1
"Kevin was heartbroken when he found out that he had over-watered his favorite plant and it died. So he studied hard about plants. Despite his efforts, this time he did not water, and the plants withered to death.",2
"The boy crying the garden His father goes for a drive to please his son. He returns home, but his younger brother is angry with his older brother and father who left him and went out to play.",1
Aston ran home from school when she got the news that her mother was very sick. Aston's mom had been diagnosed with cancer and had been getting worse by the day. Her mom died the next day as ashton sat by her bedside holding her hand.,1
"Soldier is returning home from war. They spend the rest of their lives singing together on the piano. They received good psychic readings from tarot cards and psychics, and they lived happily ever after.",1
"Tom was sick and spent many days in the hospital, sad and lonely. A new doctor came in to treat tom. Tom is now fully healed and happy with his new girlfriend.",0
"The homeless man lost his job and had to beg for money. He saved all the money people gave him. With the money he saved, he was able to buy a house.",0
"James was homeless and had no money. Fortunately, he got a job as a construction worker. While digging on the site, he found a large wad of cash and got rich!",0
"John explored medieval maps to find the treasures hidden by the ancient kings. He began his journey in search of ancient treasures. After years of searching and traveling, he found a treasure.",2
"Trevor was invited to his neighbors barbeque where there was a lot o food. Trevor ate a variety a foods and forget to check if any had peanuts since he was allergic. After a while, trevor became ill and needed to go to the hospital.",0
Noah attends a singing contest and is very nervous about the competition. He sings very well in competitions. Finally he gets the prize.,2
"Brandon enlisted to fight overseas in afghanistan even though he was really scared. On his way to enlisting, brandon got into a car accident instead and missed his chance to join the military. Now brandon can follow his dream of being a standup comic instead of going to war.",2
Matt was lonely and depressed from working so much. He decided to go shopping to throw a get-together with his friends and family. He prepared a massive feast which everyone enjoyed.,1
Samuel is a lazy man. He is always late to work. He was fired from his job and is extremely unhappy.,2
"Johnny was sad because he got sick and was recovering in the hospital. One night he suddenly got his energy back and felt much better, the medicine was working. Now Johnny has completely recovered and is back playing his favorite sport, soccer, with his friends.",0
"After the fight, jackson left tom's house and tom went for a run. On tom's run, he passed by a car wreck. When tom looked at the car wreck, he noticed jackson was being put into the ambulance due to broken bones from the wreck.",0
"Sarah was such a lovable cat. One day her owner got very sick. They her own, a little girl, died and left sarah all alone.",1
Jessica was fast asleep dreaming in her bedroom. She was being chased by an unknown shadow in her dreams. She got up and realized that it was her dream and started laughing.,2
John is a great singer. One day while he was walking on the road he got dizziness and sweating He was admitted in the hospital and is getting treatment.,0
Sachin really worked hard for his family needs. Yuvraj was a hacker who hacked sachin's bank account and transferred all his money. Sachin cried a lot when bank staff informed about this hacking issue to him.,0
"Greg loved the beach and decided to take a wonderful trip to see the ocean. Greg packed his car and drove to the beach. Another driver turned on a red light and crashed into the side of Greg's car, ruining the trip.",2
"Johnny was sad because he had fallen ill and was in the hospital recovering. Late one night he suddenly got his energy back and was feeling a lot better, the medicine was working. Now johnny is fully recovered and is back to playing his favorite sport, soccer, with his friends.",0
"She is laughing very loudly to feel the happy emotions so expressed. She won the lottery, and much money make individuals more satisfied and cheerful. She quit her job and dancing like nobody's watching and live like it's heaven on earth.",2
"Jessica and tony have been best friends since they met on the first day of school. One day after school, jessica hugged tony and told him she had a crush on him. A few years later, when the pair were in high school, tony confessed to jessica that he had a crush on her and wanted to ask her out.",1
Brad turned off the television because the pictures weren't very good. Brad did his best to repair the television using the tools. Brad realized he could have a good time by playing the piano instead.,2
He wanted to be a soldier when he grew up. He grew up to be a soldier. They put him in a corpse bag and sent him home to bury him with full military honors.,2
"The boy very fever so admit the hospital. Since the boy was the leader of the national football team, he had to inform the team manager that he was hospitalized. The team manager attend the meeting so the person is very sad.",1
"He is affected in fever so, he is admitted in hospital treatment. She is affected in pimples, so she is sad feel. A woman is attacked by an animal, so she is fear look",0
She has a fever and is being hospitalized. She is affected by acne because of the heat and feels sad. She found that the skin disease was contagious and that she couldn't be invited to the party.,0
"She bought a present for his child. On the way home, she saw a poor man in need and helped. She gave some food to the poor for her family.",2
Accident that 2 cars in opposite. car in the person was injury. Person admit the hospital for leg injury in accident so not go to walk for few months Person is cure for go to walking and healthy,0
Leslie ran through some bushes in the park. Leslie had to go to the doctor. Leslie was very allergic to the bushes and had to stay in the hospital.,0
Mia decided to get rich instantly with what she had. Mia decides to get it through gambling. But mia's decision ended wrong. he lost all his money and became a debtor.,0
Daria rushed home after school to play a new video game. She still had to finish her homework before playing video games. She finished her homework in record time and was finally able to play.,2
"Susan was poor, dumb and had few friends, but was a marvel at playing the piano. She decided to start her YouTube channel to show off her piano playing skills. She quickly became popular and performed many gigs, and she started making more money than she thought.",2
Marvin bought a new house and furnished it elegantly. Marvin enjoyed spending time and working in his home office. The faucet in his house leaked and completely flooded marvin's new home.,1
"I loved playing games at a very young age. As a teenager, I practiced my favorite video game for hours every day. Now I am making a lot of money as a pro gamer.",2
Lisa and mathew fall in love with each other Lisa and mathew had an heated argument Lisa and mathew decided to separate after the argument,1
Daria rushed home to play her new video game after school. She still had to do her homework before she could play the video game. She did her homework in record time and was finally able to play her game.,2
"Melissa goes to the airport toilet to freshen up. Melissa spends more than 30 minutes there dressing and freshening up. When she comes out there was an announcement that the flight was taking off, which shocked her.",2
A little boy was in the hospital because he wasn't feeling well. he was very ill and had to stay in bed all day hooked up to an iv. A doctor came in to see him and gave him a bad diagnosis. The little boy died shortly after and was buried in a grave next to a hill.,0
A person admitted in the hospital A girl if feeling sad see in herself on the mirror A girl is trying to escape from the men who chasing her in dream,0
"John had a bad fight with his sister beth and walked away. At home, john felt sorry for how rude he was to beth. John ran back to beth, hugged her tight and apologized.",1
Jack likes to play football in his free time. On 23rd monday jack went to play football with his friends. While playing football jack fell down and he had severe pain in head so he was admitted in hospital.,0
Tony is a good singer and he loves emily from past two years One fine day he proposed emily but emily went suddenly without answering tony. After few days later she accept his proposal. tony is so happy.,1
"John was a fun baby and loved to make his mom laugh. At the age of 18, he decided to do stand-up comedy. John immediately became popular and became the biggest celebrity in his town.",2
"Billy was sick in the hospital and dreamed of going to the beach. As soon as he got out of the hospital, he got on a plane and flew to the beach. The beach was beautiful and he enjoyed his time there.",2
"Pietro grew up wanting to be a police officer. He started working hard to become a police officer, he built a body and knowledge, and Pietro finally become a police officer on his 23rd birthday.",2
"On the way to the beach, Mary walks the wrong way and gets lost. Her path leads to some of the most beautiful beaches she has ever seen.",2
Steve was a soldier who was sent off to war. He wanted to provide a good life for his wife back home. Steve ended up dying in a car accident.,1
Tendulkar is a sincere worker who really worked hard for his family. Osama is a hacker who hacked tendulkar's bank account and he transferred all his money. Tendulkar cried a lot when he know about this hacking issue.,1
"Pat loved eating donuts. They went shopping for more donuts. While rushing home to eat their new donuts, they got into a bad car accident.",0
Jasmine's mother was in the hospital because she was very sick. Jasmine's mother died and was buried in the family cemetery. Jasmine cries every day because she misses her dear mother.,1
